{
  "$schema": "http://json-schema.org/draft-07/schema#",
  "title": "Avtal",
  "description": "Avtal / Agreement — composable block-based format",
  "type": "object",
  "required": ["title", "party1", "party2", "body"],
  "definitions": {
    "party": {
      "type": "object",
      "required": ["name"],
      "properties": {
        "name": { "type": "string", "description": "Party name (company or person)" },
        "org_number": { "type": "string", "description": "Organization number (for companies)" },
        "id_number": { "type": "string", "description": "Personal identity number (for individuals)" },
        "address": { "type": "string", "description": "Full address as a single line" },
        "address_line1": { "type": "string", "description": "Street address" },
        "address_line2": { "type": "string", "description": "Postal code and city" },
        "signatory": { "type": "string", "description": "Name of person signing" }
      }
    },
    "clause_item": {
      "description": "A clause item — plain string, or object with nested items. Use 'title' for a bold heading, 'text' for plain inline text.",
      "oneOf": [
        { "type": "string" },
        {
          "type": "object",
          "required": ["items"],
          "anyOf": [
            { "required": ["title"] },
            { "required": ["text"] }
          ],
          "properties": {
            "title": { "type": "string", "description": "Bold heading for the sub-clause" },
            "text": { "type": "string", "description": "Plain (non-bold) text under the heading" },
            "list": { "type": "string", "enum": ["numbered", "bullet"], "default": "numbered", "description": "List style for child items" },
            "items": {
              "type": "array",
              "items": { "$ref": "#/definitions/clause_item" },
              "minItems": 1
            }
          }
        }
      ]
    }
  },
  "properties": {
    "header": { "type": "string", "enum": ["standard", "minimal", "none"], "default": "standard", "description": "Header layout" },
    "title": { "type": "string", "description": "Agreement title" },
    "lang": { "type": "string", "default": "sv", "description": "sv or en" },
    "party1": { "$ref": "#/definitions/party" },
    "party2": { "$ref": "#/definitions/party" },
    "body": {
      "type": "array",
      "description": "Ordered list of document blocks",
      "items": {
        "oneOf": [
          {
            "type": "object",
            "required": ["type"],
            "properties": {
              "type": { "type": "string", "enum": ["title_page"] }
            },
            "additionalProperties": false
          },
          {
            "type": "object",
            "required": ["type"],
            "properties": {
              "type": { "type": "string", "enum": ["parties"] },
              "label1": { "type": "string", "default": "Part 1", "description": "Label for party 1 fieldset" },
              "label2": { "type": "string", "default": "Part 2", "description": "Label for party 2 fieldset" }
            },
            "additionalProperties": false
          },
          {
            "type": "object",
            "required": ["type", "text"],
            "properties": {
              "type": { "type": "string", "enum": ["heading"] },
              "text": { "type": "string" }
            },
            "additionalProperties": false
          },
          {
            "type": "object",
            "required": ["type", "text"],
            "properties": {
              "type": { "type": "string", "const": "text" },
              "text": { "type": "string" }
            },
            "additionalProperties": false
          },
          {
            "type": "object",
            "required": ["type", "title", "items"],
            "properties": {
              "type": { "type": "string", "enum": ["clause"] },
              "title": { "type": "string" },
              "items": {
                "type": "array",
                "items": { "$ref": "#/definitions/clause_item" },
                "minItems": 1
              }
            },
            "additionalProperties": false
          },
          {
            "type": "object",
            "required": ["type"],
            "properties": {
              "type": { "type": "string", "enum": ["signatures"] },
              "new_page": { "type": "boolean", "default": true, "description": "Start signatures on a new page" }
            },
            "additionalProperties": false
          }
        ]
      },
      "minItems": 1
    }
  }
}
