{
  "title": "Konsultavtal",
  "lang": "sv",
  "party1": {
    "name": "Uppdragsgivaren AB",
    "org_number": "556789-0123",
    "address_line1": "Storgatan 10",
    "address_line2": "111 22 Stockholm",
    "signatory": "Anna Andersson, VD"
  },
  "party2": {
    "name": "Erik Eriksson",
    "id_number": "850101-1234",
    "address": "Lilla vägen 3, 222 33 Göteborg",
    "signatory": "Erik Eriksson"
  },
  "body": [
    {
      "type": "title_page"
    },
    {
      "type": "heading",
      "text": "Konsultavtal"
    },
    {
      "type": "parties"
    },
    {
      "type": "text",
      "text": "Detta avtal reglerar villkoren för konsulttjänster mellan parterna."
    },
    {
      "type": "clause",
      "title": "Uppdrag",
      "items": [
        "Konsulten åtar sig att utföra de tjänster som specificeras i bilaga 1."
      ]
    },
    {
      "type": "clause",
      "title": "Avtalstid",
      "items": [
        "Avtalet gäller från och med 2026-03-01 till och med 2026-12-31.",
        "Avtalet kan förlängas med 12 månader i taget om ingen part säger upp det senast 3 månader före avtalstidens utgång.",
        "Uppsägning ska ske skriftligen."
      ]
    },
    {
      "type": "clause",
      "title": "Ersättning",
      "items": [
        "Konsulten erhåller ersättning enligt överenskommen timtaxa.",
        {
          "title": "Fakturering",
          "items": [
            "Fakturering sker månadsvis i efterskott.",
            {
              "title": "Fakturauppgifter",
              "text": "Varje faktura ska innehålla:",
              "list": "bullet",
              "items": [
                "Avtalsnummer och referensperson",
                "Aktuell period",
                "Specifikation av utförda timmar per uppdrag",
                "Tillämplig timtaxa"
              ]
            },
            "Fakturor ska skickas elektroniskt i PDF-format.",
            "Betalningsvillkor: 30 dagar netto."
          ]
        },
        "Vid försenad betalning utgår dröjsmålsränta enligt räntelagen."
      ]
    },
    {
      "type": "clause",
      "title": "Sekretess",
      "items": [
        "Parterna förbinder sig att inte utan den andra partens medgivande röja konfidentiell information som erhållits inom ramen för detta avtal."
      ]
    },
    {
      "type": "signatures",
      "new_page": false
    }
  ]
}
